{
  "schemaVersion": 1,
  "contentVersion": "2025-11",
  "currency": "EUR",
  "source": {
    "documentedOrigin": "Repository PDF price lists transferred to speisekarte.html; see README.md",
    "asOf": "2025-11",
    "files": [
      {
        "path": "menu/speisekarte.pdf",
        "sha256": "29f337aa13f68ae275ae558116ce81fd8172ac8efded5bf2256917e409c97b15"
      },
      {
        "path": "menu/sushi-karte.pdf",
        "sha256": "18da0ebffcec5a48d34521967d951034ce43cc8f753a1ac0f3d88077ca99fdbc"
      }
    ],
    "migrationBaseline": "tests/fixtures/menu-pre-migration.v1.json"
  },
  "priceModes": {
    "default": "day",
    "supported": [
      "day",
      "evening"
    ]
  },
  "suggestions": {
    "starter": [
      "vorspeisen-11",
      "suppen-2"
    ],
    "dessert": [
      "desserts-80"
    ]
  },
  "categories": [
    {
      "id": "sushi-menues",
      "sort": 1,
      "name": {
        "de": "Sushi-Menüs",
        "en": "Sushi Sets"
      },
      "note": {
        "de": "Zusammengestellte Menüs für 1–3 Personen.",
        "en": "Set menus for 1–3 people."
      },
      "notePosition": "before-items",
      "items": [
        {
          "id": "sushi-menues-200",
          "visibleNumber": "200",
          "sort": 1,
          "name": {
            "de": "Sapporo (nur Lachs)",
            "en": "Sapporo (salmon only)"
          },
          "description": {
            "de": "3 Lachs Nigiri, 3 Lachs Maki",
            "en": "3 salmon nigiri, 3 salmon maki"
          },
          "prices": {
            "dayCents": 900,
            "eveningCents": 1000
          },
          "available": true
        },
        {
          "id": "sushi-menues-202",
          "visibleNumber": "202",
          "sort": 2,
          "name": {
            "de": "Nara",
            "en": "Nara"
          },
          "description": {
            "de": "5 Nigiri: 2 Lachs, 2 Thunfisch, Ebi · 3 Lachs Maki, 3 Thunfisch Maki",
            "en": "5 nigiri: 2 salmon, 2 tuna, shrimp · 3 salmon maki, 3 tuna maki"
          },
          "prices": {
            "dayCents": 1300,
            "eveningCents": 1400
          },
          "available": true
        },
        {
          "id": "sushi-menues-203",
          "visibleNumber": "203",
          "sort": 3,
          "name": {
            "de": "Kyoto",
            "en": "Kyoto"
          },
          "description": {
            "de": "6 Nigiri: 3 Lachs, Thunfisch, Ebi, Oktopus · 3 Lachs Maki, 3 Thunfisch Maki · 3 California Maki, 3 Alaska Maki",
            "en": "6 nigiri: 3 salmon, tuna, shrimp, octopus · 3 salmon maki, 3 tuna maki · 3 California maki, 3 Alaska maki"
          },
          "prices": {
            "dayCents": 1600,
            "eveningCents": 1700
          },
          "available": true
        },
        {
          "id": "sushi-menues-204",
          "visibleNumber": "204",
          "sort": 4,
          "name": {
            "de": "Tokyo",
            "en": "Tokyo"
          },
          "description": {
            "de": "6 Nigiri: 2 Lachs, Thunfisch, Ebi, Tobiko, Tintenfisch · 6 Lachs Maki, 6 Boston Maki",
            "en": "6 nigiri: 2 salmon, tuna, shrimp, tobiko, squid · 6 salmon maki, 6 Boston maki"
          },
          "prices": {
            "dayCents": 1850,
            "eveningCents": 1950
          },
          "available": true
        },
        {
          "id": "sushi-menues-205",
          "visibleNumber": "205",
          "sort": 5,
          "name": {
            "de": "Kyoto (Menü 2)",
            "en": "Kyoto (Menu 2)"
          },
          "description": {
            "de": "4 Nigiri: 2 Lachs, 2 Thunfisch · 6 Sake-Philadelphia Maki · 4 Futo Maki",
            "en": "4 nigiri: 2 salmon, 2 tuna · 6 salmon-Philadelphia maki · 4 futo maki"
          },
          "prices": {
            "dayCents": 1850,
            "eveningCents": 1950
          },
          "available": true
        },
        {
          "id": "sushi-menues-206",
          "visibleNumber": "206",
          "sort": 6,
          "name": {
            "de": "Nagano",
            "en": "Nagano"
          },
          "description": {
            "de": "3 Lachs Maki, 3 Thunfisch Maki · 3 Gurken Maki, 3 Avocado Maki · 3 California Maki, 3 Alaska Maki",
            "en": "3 salmon maki, 3 tuna maki · 3 cucumber maki, 3 avocado maki · 3 California maki, 3 Alaska maki"
          },
          "prices": {
            "dayCents": 1200,
            "eveningCents": 1300
          },
          "available": true
        },
        {
          "id": "sushi-menues-207",
          "visibleNumber": "207",
          "sort": 7,
          "name": {
            "de": "Mashiko",
            "en": "Mashiko"
          },
          "description": {
            "de": "3 Lachs Maki, 3 Thunfisch Maki · 3 Gurken Maki, 6 Avocado Maki · 3 Rettich Maki, 3 Kürbis Maki, 3 Surimi Maki",
            "en": "3 salmon maki, 3 tuna maki · 3 cucumber maki, 6 avocado maki · 3 radish maki, 3 pumpkin maki, 3 surimi maki"
          },
          "prices": {
            "dayCents": 1200,
            "eveningCents": 1300
          },
          "available": true
        },
        {
          "id": "sushi-menues-208",
          "visibleNumber": "208",
          "sort": 8,
          "name": {
            "de": "Nagasaki",
            "en": "Nagasaki"
          },
          "description": {
            "de": "6 Sake-Philadelphia Maki · 6 Boston Maki · 6 California Maki",
            "en": "6 salmon-Philadelphia maki · 6 Boston maki · 6 California maki"
          },
          "prices": {
            "dayCents": 1500,
            "eveningCents": 1600
          },
          "available": true
        },
        {
          "id": "sushi-menues-209",
          "visibleNumber": "209",
          "sort": 9,
          "name": {
            "de": "Sake Set",
            "en": "Sake Set"
          },
          "description": {
            "de": "2 Lachs Nigiri, 1 Alaska Temaki · 6 Lachs Maki · 6 Alaska Maki",
            "en": "2 salmon nigiri, 1 Alaska temaki · 6 salmon maki · 6 Alaska maki"
          },
          "prices": {
            "dayCents": 1500,
            "eveningCents": 1600
          },
          "available": true
        },
        {
          "id": "sushi-menues-211",
          "visibleNumber": "211",
          "sort": 10,
          "name": {
            "de": "Mix Maki Set",
            "en": "Mix Maki Set"
          },
          "qualifier": {
            "de": "(für 2 Personen)",
            "en": "(for 2 people)"
          },
          "description": {
            "de": "6 Lachs Maki, 6 Thunfisch Maki · 6 Avocado Maki, 6 Boston Maki · 6 Ocean Maki, 6 Regenbogen Maki · 1 kleine Sashimi Moriawase",
            "en": "6 salmon maki, 6 tuna maki · 6 avocado maki, 6 Boston maki · 6 ocean maki, 6 rainbow maki · 1 small sashimi moriawase"
          },
          "prices": {
            "dayCents": 4500,
            "eveningCents": 4600
          },
          "available": true
        },
        {
          "id": "sushi-menues-212",
          "visibleNumber": "212",
          "sort": 11,
          "name": {
            "de": "Mito",
            "en": "Mito"
          },
          "qualifier": {
            "de": "(für 2 Personen)",
            "en": "(for 2 people)"
          },
          "description": {
            "de": "16 Nigiri: 4 Lachs, 2 Thunfisch, 2 Ebi, 2 Oktopus, 2 Tintenfisch, 2 Tobiko, 2 Hornmuscheln · 4 Futo Maki · 6 Sakekawa Maki, 6 Avocado Maki",
            "en": "16 nigiri: 4 salmon, 2 tuna, 2 shrimp, 2 octopus, 2 squid, 2 tobiko, 2 surf clam · 4 futo maki · 6 sakekawa maki, 6 avocado maki"
          },
          "prices": {
            "dayCents": 5000,
            "eveningCents": 5100
          },
          "available": true
        },
        {
          "id": "sushi-menues-214",
          "visibleNumber": "214",
          "sort": 12,
          "name": {
            "de": "Sumo",
            "en": "Sumo"
          },
          "qualifier": {
            "de": "(für 3 Personen)",
            "en": "(for 3 people)"
          },
          "description": {
            "de": "21 Nigiri: 6 Lachs, 3 Thunfisch, 3 Ebi, 3 Aal, 3 Tobiko, 3 Hornmuscheln · 6 Boston Maki, 6 Alaska Maki · 6 Ebi-Tempura Maki",
            "en": "21 nigiri: 6 salmon, 3 tuna, 3 shrimp, 3 eel, 3 tobiko, 3 surf clam · 6 Boston maki, 6 Alaska maki · 6 shrimp tempura maki"
          },
          "prices": {
            "dayCents": 6300,
            "eveningCents": 6400
          },
          "available": true
        }
      ]
    },
    {
      "id": "nigiri",
      "sort": 2,
      "name": {
        "de": "Nigiri Sushi",
        "en": "Nigiri Sushi"
      },
      "detail": {
        "de": "(1 Stück)",
        "en": "(1 piece)"
      },
      "items": [
        {
          "id": "nigiri-101",
          "visibleNumber": "101",
          "sort": 1,
          "name": {
            "de": "Inari",
            "en": "Inari"
          },
          "description": {
            "de": "Tofutasche",
            "en": "Tofu pouch"
          },
          "prices": {
            "dayCents": 250
          },
          "available": true
        },
        {
          "id": "nigiri-102",
          "visibleNumber": "102",
          "sort": 2,
          "name": {
            "de": "Tamago",
            "en": "Tamago"
          },
          "description": {
            "de": "Eierstich",
            "en": "Omelette"
          },
          "prices": {
            "dayCents": 250
          },
          "available": true
        },
        {
          "id": "nigiri-103",
          "visibleNumber": "103",
          "sort": 3,
          "name": {
            "de": "Tako",
            "en": "Tako"
          },
          "description": {
            "de": "Oktopus",
            "en": "Octopus"
          },
          "prices": {
            "dayCents": 300
          },
          "available": true
        },
        {
          "id": "nigiri-104",